{
  "unit": "grammar/hrpc/tokens",
  "layer": "grammar",
  "source": "tools/peg_gen/grammars/hrpc.peg#L55-L95",
  "source_hash": "bf7eb5a7634dfd4d",
  "rules": [
    {
      "id": "lex.hrpc.keywords",
      "domain": "lex",
      "title": "HRPC IDL keywords",
      "statement": "The HRPC interface-definition language reserves the keyword tokens: `package`, `import`, `option`, `message`, `enum`, `service`, `rpc`, `returns`, `stream`, `repeated`, `optional`, `required`, `map`, `oneof`.",
      "evidence": ["tools/peg_gen/grammars/hrpc.peg#L56-L70"],
      "uncertainty": "HRPC is a separate IDL surface (RPC schema), not the Logos source language."
    },
    {
      "id": "lex.hrpc.punctuation",
      "domain": "lex",
      "title": "HRPC punctuation tokens",
      "statement": "HRPC punctuation tokens: `{` `}` `(` `)` `<` `>` `;` `=` `,` `.` (LBRACE RBRACE LPAREN RPAREN LANGLE RANGLE SEMICOLON EQUALS COMMA DOT).",
      "evidence": ["tools/peg_gen/grammars/hrpc.peg#L73-L82"]
    },
    {
      "id": "lex.hrpc.string-literal",
      "domain": "lex",
      "title": "HRPC string literal",
      "statement": "A STRING literal is a double-quoted sequence matching /\"([^\"\\\\]|\\\\.)*\"/: any chars except quote/backslash, or a backslash escaping any single char, delimited by `\"`.",
      "evidence": ["tools/peg_gen/grammars/hrpc.peg#L85"]
    },
    {
      "id": "lex.hrpc.integer-literal",
      "domain": "lex",
      "title": "HRPC integer literal",
      "statement": "An INTEGER literal is one or more decimal digits /[0-9]+/; no sign, base prefix, or separators.",
      "evidence": ["tools/peg_gen/grammars/hrpc.peg#L86"]
    },
    {
      "id": "lex.hrpc.identifier",
      "domain": "lex",
      "title": "HRPC identifier",
      "statement": "An IDENT matches /[a-zA-Z_][a-zA-Z0-9_]*/: leading ASCII letter or underscore, followed by ASCII letters, digits, or underscores.",
      "evidence": ["tools/peg_gen/grammars/hrpc.peg#L89"]
    },
    {
      "id": "lex.hrpc.whitespace-skip",
      "domain": "lex",
      "title": "HRPC whitespace is insignificant",
      "statement": "Whitespace /[ \\t\\n\\r]+/ is skipped between tokens and is not significant.",
      "evidence": ["tools/peg_gen/grammars/hrpc.peg#L92"]
    },
    {
      "id": "lex.hrpc.comments",
      "domain": "lex",
      "title": "HRPC comments",
      "statement": "HRPC supports line comments /\\/\\/[^\\n]*/ (to end of line) and block comments /\\/\\*.*?\\*\\// (non-greedy, may span lines); both are skipped as trivia.",
      "evidence": ["tools/peg_gen/grammars/hrpc.peg#L93-L94"]
    }
  ]
}
